{
  "entity": {
    "userId": "virtru26@gmail.com",
    "attributes": [
      {
        "jwt": "eyJhbGciOiJIUzI1NiIsInR5cCI6IkpXVCJ9.eyJ1cmwiOiJodHRwczovL2FhLnZpcnRydS5jb20vYXR0ci91bmlxdWUtaWRlbnRpZmllci92YWx1ZS83YjczODk2OC0xMzFhLTRkZTktYjRhMS1jOTIyZjYwNTgzZTMiLCJuYW1lIjoiN2I3Mzg5NjgtMTMxYS00ZGU5LWI0YTEtYzkyMmY2MDU4M2UzIiwiaWF0IjoxNTQwNTg2NTczLCJleHAiOjE1NDA2NzI5NzN9.7vhZCMgZF3ZY4mr7zHI17gQGGeC20BX1yGEwicL19DU"
      },
      {
        "jwt": "eyJhbGciOiJIUzI1NiIsInR5cCI6IkpXVCJ9.eyJ1cmwiOiJodHRwczovL2FhLnZpcnRydS5jb20vYXR0ci9wcmltYXJ5LW9yZ2FuaXphdGlvbi92YWx1ZS83YjczODk2OC0xMzFhLTRkZTktYjRhMS1jOTIyZjYwNTgzZTMiLCJuYW1lIjoiN2I3Mzg5NjgtMTMxYS00ZGU5LWI0YTEtYzkyMmY2MDU4M2UzIiwiaWF0IjoxNTQwNTg2NTczLCJleHAiOjE1NDA2NzI5NzN9.lq1Pfn4MR5DpjOlTXKMI8gioBOBNSBM9UT4SodLUXag"
      }
    ],
    "publicKey": "-----BEGIN PUBLIC KEY-----\nMIIBIjANBgkqhkiG9w0BAQEFAAOCAQ8AMIIBCgKCAQEAseSTcIibaHJGyC+qIHht\nJ/vAFKhKzfv8KBbgeiH1/UVE+OrVWDASbuaEbE1RKZQsdax2UTAIQ7fC/uU6wzb2\nJbCLpXU8ckpBkxDtfSpm8jI/fRKlSyUetcnmp+bpKCHJ/9Zn3meqmRiAskyObQI2\nD5GTO3yiqr6edXn9Dz02l4tk6Px1yRMaPIPy2is41bRVGJHZVM3su7oWqA4oqxmh\nPE5qcqRj6lZ6PhXhD8fivump1par7XlJiNDl7+KcNxWimrQC0IXm7Xg9lFqLmDSF\nrkcJoVVz/v4C3nsNFPkick1w0Ov7FqCxLzQVNNR3KEOAe5dVzaJqtO2iw+RdCQ/Y\nKQIDAQAB\n-----END PUBLIC KEY-----\n",
    "cert": "eyJhbGciOiJIUzI1NiIsInR5cCI6IkpXVCJ9.eyJ1c2VySWQiOiJ2aXJ0cnUyNkBnbWFpbC5jb20iLCJhdHRyaWJ1dGVzIjpbeyJqd3QiOiJleUpoYkdjaU9pSklVekkxTmlJc0luUjVjQ0k2SWtwWFZDSjkuZXlKMWNtd2lPaUpvZEhSd2N6b3ZMMkZoTG5acGNuUnlkUzVqYjIwdllYUjBjaTkxYm1seGRXVXRhV1JsYm5ScFptbGxjaTkyWVd4MVpTODNZamN6T0RrMk9DMHhNekZoTFRSa1pUa3RZalJoTVMxak9USXlaall3TlRnelpUTWlMQ0p1WVcxbElqb2lOMkkzTXpnNU5qZ3RNVE14WVMwMFpHVTVMV0kwWVRFdFl6a3lNbVkyTURVNE0yVXpJaXdpYVdGMElqb3hOVFF3TlRnMk5UY3pMQ0psZUhBaU9qRTFOREEyTnpJNU56TjkuN3ZoWkNNZ1pGM1pZNG1yN3pISTE3Z1FHR2VDMjBCWDF5R0V3aWNMMTlEVSJ9LHsiand0IjoiZXlKaGJHY2lPaUpJVXpJMU5pSXNJblI1Y0NJNklrcFhWQ0o5LmV5SjFjbXdpT2lKb2RIUndjem92TDJGaExuWnBjblJ5ZFM1amIyMHZZWFIwY2k5d2NtbHRZWEo1TFc5eVoyRnVhWHBoZEdsdmJpOTJZV3gxWlM4M1lqY3pPRGsyT0MweE16RmhMVFJrWlRrdFlqUmhNUzFqT1RJeVpqWXdOVGd6WlRNaUxDSnVZVzFsSWpvaU4ySTNNemc1TmpndE1UTXhZUzAwWkdVNUxXSTBZVEV0WXpreU1tWTJNRFU0TTJVeklpd2lhV0YwSWpveE5UUXdOVGcyTlRjekxDSmxlSEFpT2pFMU5EQTJOekk1TnpOOS5scTFQZm40TVI1RHBqT2xUWEtNSThnaW9CT0JOU0JNOVVUNFNvZExVWGFnIn1dLCJwdWJsaWNLZXkiOiItLS0tLUJFR0lOIFBVQkxJQyBLRVktLS0tLVxuTUlJQklqQU5CZ2txaGtpRzl3MEJBUUVGQUFPQ0FROEFNSUlCQ2dLQ0FRRUFzZVNUY0lpYmFISkd5QytxSUhodFxuSi92QUZLaEt6ZnY4S0JiZ2VpSDEvVVZFK09yVldEQVNidWFFYkUxUktaUXNkYXgyVVRBSVE3ZkMvdVU2d3piMlxuSmJDTHBYVThja3BCa3hEdGZTcG04akkvZlJLbFN5VWV0Y25tcCticEtDSEovOVpuM21lcW1SaUFza3lPYlFJMlxuRDVHVE8zeWlxcjZlZFhuOUR6MDJsNHRrNlB4MXlSTWFQSVB5MmlzNDFiUlZHSkhaVk0zc3U3b1dxQTRvcXhtaFxuUEU1cWNxUmo2bFo2UGhYaEQ4Zml2dW1wMXBhcjdYbEppTkRsNytLY054V2ltclFDMElYbTdYZzlsRnFMbURTRlxucmtjSm9WVnovdjRDM25zTkZQa2ljazF3ME92N0ZxQ3hMelFWTk5SM0tFT0FlNWRWemFKcXRPMml3K1JkQ1EvWVxuS1FJREFRQUJcbi0tLS0tRU5EIFBVQkxJQyBLRVktLS0tLVxuIiwiaWF0IjoxNTQwNTg2NTczLCJleHAiOjE1NDA2NzI5NzN9.ccdWOGptT924_8efFu5HO7lGY7B5a_8VEiRuXdJwSCQ"
  },
  "policy": "eyJ1dWlkIjoiMTExMS0yMjIyLTMzMzMzLTQ0NDQ0LWFiZGRlZi10aW1lc3RhbXAiLCJib2R5Ijp7ImRhdGFBdHRyaWJ1dGVzIjpbeyJ1cmwiOiJodHRwczovL2FhLnZpcnRydS5jb20vYXR0ci91bmlxdWUtaWRlbnRpZmllci92YWx1ZS83YjczODk2OC0xMzFhLTRkZTktYjRhMS1jOTIyZjYwNTgzZTMiLCJuYW1lIjoiN2I3Mzg5NjgtMTMxYS00ZGU5LWI0YTEtYzkyMmY2MDU4M2UzIn0seyJ1cmwiOiJodHRwczovL2FhLnZpcnRydS5jb20vYXR0ci9wcmltYXJ5LW9yZ2FuaXphdGlvbi92YWx1ZS83YjczODk2OC0xMzFhLTRkZTktYjRhMS1jOTIyZjYwNTgzZTMiLCJuYW1lIjoiN2I3Mzg5NjgtMTMxYS00ZGU5LWI0YTEtYzkyMmY2MDU4M2UzIn1dLCJkaXNzZW0iOlsidmlydHJ1MjZAZ21haWwuY29tIl19fQ==",
  "binding": "MmZiYjYxYmQyNDJkMDFhZDJlOWJmY2JmMzM4MmEzMTgxYjY1ZjVmMmNjM2M3MWYzYTk0MTlmZDU3Njg3ZjYxNw==",
  "wrapped_key": "tzFpkQ3MHqb0O4N7AWJmzrZJKUNG+X5C+aWuQpGVGZe3sidnKb2TBcH75/ku26yeHa7VWax3syHwc2rgzr1cblTXXDDot/L8NX9iDGpG1GoucZO2KonxUB5ISfUnoGNKSouzHrfo/B8eyKAXlSCbi0BQzhScfGkEOT1YYr0Cs+BWQWN0pS4OXY73o0d0kWG0eVUl9jHK5dfc7BpeWKJANxu0ow1VR74XTnw2AL0Lk8opff59U58IxoUZDBuDLWGq1wUxhNlpzukYG6/Yje4XDN3jg82C9d/DPF/fnYWOxpXLx3wfScS3NqQCGpP+t6w21/rCDpXIsy5vwXdEQ6L/3A==",
  "auth_token": "eyJhbGciOiJSUzI1NiIsInR5cCI6IkpXVCJ9.eyJpYXQiOjE1NDA1ODY1NzMsImV4cCI6MTU0MDU4NjYzM30.BWhT4zEiEb60_PZyGXeYqZzaysuKPL2pCc-D4AHFEZiGzTSj0j9Mlsfj7qZiuEJhOKn_iufRztMzMJqCk0HboEatxwc4-XPxN5UOqw1zoyOy8J9A-V9JiT5aAvZ9E4nEg8TkEZeki1jlA9edyAuKD6dyv6_mt39ydB74KnKshwkh2uxmjzExa3hr_csVR9-QnHEYyM4nqJkU6-LpUBvgt0BhY0O6cz8R2ez-bKUnHQntYS5k-FaSpM1zMs-O-p9h0UZ6cl2PFgfqkwGC8aRLSQvljz_3GmxEp8_wqP02nFOBqt5Br5LclfStr8wKZjYvgu_kqT0D-6MdrmzccSzjEA",
  "metadata": {
    "algorithm": "AES-256-GCM",
    "iv": "DzF1r04BaAmf1Z4h",
    "ciphertext": "DzF1r04BaAmf1Z4hSTnKmWOVhfy29XKKadFj3g==",
    "plaintext": ""
  }
}
